{
  "$schema": "../schema/vprs.schema.json",
  "meta": {
    "projectId": "BP-TAX-014",
    "catalogRef": "PC-FIN-TAX-07 — Unit Tax Compliance Review & SP2DK Support",
    "title": "Unit Tax Compliance Review & SP2DK Support",
    "solutionType": "AI / Agentic AI",
    "version": "1.0 — Issued for Vendor Quotation",
    "status": "Draft for Vendor RFP",
    "businessUnit": "Group Finance — Tax Management (Head Office) & Unit Finance",
    "processOwner": "Group Tax Manager",
    "technicalOwner": "Head of Finance Systems / System Accountant",
    "preparedBy": "Blueprint AI — Production Readiness Module",
    "issueDate": "2026-08-27",
    "classification": "Confidential — Vendor Distribution Under NDA",
    "readinessScore": "91%",
    "language": "en",
    "organisation": "Siloam Hospitals Group"
  },
  "overview": {
    "problem": "SP2DK (Surat Permintaan Penjelasan atas Data dan/atau Keterangan) letters arrive at hospital units from their local KPP with a 14-calendar-day response window. Preparing a defensible response requires reconstructing an equalisation between reported revenue, VAT bases, withholding tax objects and the general ledger — data that sits in at least four systems. Unit finance teams routinely consume 3–5 working days of senior time per letter, and under time pressure some responses are submitted with incomplete evidence, which materially raises the probability of escalation to a full tax audit (pemeriksaan).",
    "objectives": [
      "Reduce median SP2DK response preparation time from 3–5 working days to under 1 working day of reviewer effort.",
      "Guarantee that no SP2DK response leaves the Group without a complete, source-referenced evidence pack.",
      "Detect the equalisation gaps that trigger SP2DK proactively, on a quarterly cycle, before DJP raises them.",
      "Produce a consistent, auditable position across all hospital entities for the same class of tax question."
    ],
    "currentState": "Manual. The unit tax officer reads the letter, interprets the data DJP is questioning, requests extracts from Finance Systems, builds an equalisation worksheet in Excel, drafts the tanggapan letter in Word, and circulates for review by email. There is no group-level register of open SP2DK, no standard evidence pack, and no reuse of positions previously argued successfully at another unit.",
    "targetState": "An agentic workflow ingests the SP2DK, classifies the tax issue, retrieves and reconciles the supporting data, drafts a fully cited response pack, and presents it to the Unit Financial Controller and Group Tax Manager for review and approval. The agent never transmits anything to DJP. Submission through Coretax remains a deliberate human act.",
    "volumetrics": [
      {
        "metric": "Hospital entities / branch NPWPs in scope",
        "value": "Phase 1: 6 units · Full rollout: all Group entities"
      },
      {
        "metric": "SP2DK received (Group, trailing 12 months)",
        "value": "To be confirmed from Group Tax register — see OQ-002"
      },
      {
        "metric": "Peak concurrency",
        "value": "Assume 8 concurrent open SP2DK across the Group"
      },
      {
        "metric": "Statutory response window",
        "value": "14 calendar days from the date of the SP2DK"
      },
      {
        "metric": "Evidence retention obligation",
        "value": "10 years (UU KUP Art. 28(11))"
      }
    ]
  },
  "solution": {
    "summary": "A supervised agentic AI caseworker for SP2DK response preparation and pre-emptive equalisation review. The agent operates as a retrieval-and-drafting specialist over Group tax and finance data, with a hard stop before any external filing action.",
    "autonomyLevel": "Level 2 — Agent executes multi-step retrieval, reconciliation and drafting. Every externally visible artefact requires named human approval. No write-back to any system of record and no transmission to DJP.",
    "agentPattern": "Plan → Retrieve → Reconcile → Draft → Cite → Escalate for approval. Deterministic tools perform all arithmetic; the language model performs classification, evidence selection and narrative drafting only.",
    "components": [
      {
        "component": "SP2DK Intake & Classifier",
        "responsibility": "Parse the inbound letter (PDF/scan/Coretax export), extract KPP, letter number, date, entity NPWP, tax period, and the specific data points DJP is questioning. Classify into one of the defined issue archetypes."
      },
      {
        "component": "Evidence Retrieval Tools",
        "responsibility": "Deterministic connectors that query the ERP general ledger, the SPT archive, the e-Faktur/e-Bupot extracts and the HIS revenue detail for the identified entity and period."
      },
      {
        "component": "Equalisation Engine",
        "responsibility": "Deterministic calculation service. Performs the revenue-to-VAT-base and expense-to-withholding-object reconciliations and returns a variance schedule with line-level traceability. No LLM arithmetic."
      },
      {
        "component": "Response Drafter",
        "responsibility": "Generates the tanggapan letter narrative and the evidence index, in Bahasa Indonesia, in the Group's approved format, with a mandatory source citation against every figure asserted."
      },
      {
        "component": "Case & SLA Manager",
        "responsibility": "Maintains the group SP2DK register, tracks the 14-day clock, drives reminders and escalations, and holds the approval audit trail."
      },
      {
        "component": "Proactive Review Scheduler",
        "responsibility": "Runs the same equalisation logic on a quarterly cycle across all entities without an SP2DK trigger, and reports gaps above the materiality threshold."
      }
    ]
  },
  "scope": {
    "inScope": [
      "Ingestion and classification of SP2DK letters received via Coretax account export, registered email, and scanned physical mail.",
      "The five tax issue archetypes defined in Section 4 (PPN equalisation, PPh Badan revenue equalisation, PPh 21 tenaga ahli, PPh 23, PPh 4(2) final).",
      "Automated retrieval and reconciliation of GL, SPT, e-Faktur and e-Bupot data for the entity and period under question.",
      "Generation of a draft tanggapan letter in Bahasa Indonesia plus an indexed evidence pack (PDF and XLSX).",
      "Two-tier human review and approval workflow with a full, immutable audit trail.",
      "Group-level SP2DK case register with 14-day SLA tracking, reminders and escalation.",
      "Quarterly pre-emptive equalisation review across in-scope entities.",
      "A precedent library of previously approved Group positions, retrievable by issue archetype."
    ],
    "outOfScope": [
      "Any transmission, filing or submission to DJP. Coretax remains operated exclusively by authorised Group Tax personnel.",
      "Write-back of any value to the ERP, the HIS, or any system of record. The solution is read-only against all source systems.",
      "Determination of the Group's final tax position. The agent produces a recommended position; the qualified tax professional owns it.",
      "Handling of Pemeriksaan (formal tax audit), Bukti Permulaan, Keberatan or Banding proceedings.",
      "Transfer pricing documentation, tax provisioning, and deferred tax computation.",
      "Any processing of patient-identifiable clinical data. Revenue data is consumed at the aggregated and coded level only.",
      "Direct API integration with Coretax DJP. No taxpayer-facing API is available — see AS-003.",
      "Amendment of SPT (pembetulan). Where the agent's analysis indicates an amendment is warranted, it raises a flagged recommendation only."
    ]
  },
  "process": {
    "figureCaption": "Figure 1 — SP2DK response lifecycle. Source Systems denotes the ERP general ledger, the SPT archive, the e-Faktur/e-Bupot extracts and HIS revenue detail (Section 6). Every externally visible artefact passes a named human approval before it leaves the Group; the agent has no path to DJP.",
    "narrative": "The trigger is the arrival of an SP2DK. The agent's work is bounded on one end by an inbound document it did not request, and on the other by a human being who signs the response. Everything in between is retrieval, arithmetic and drafting — and every figure it asserts must point back at a row in a source system.",
    "mermaid": "sequenceDiagram\n    participant KPP as KPP / DJP\n    participant IN as Intake\n    participant AG as SP2DK Agent\n    participant SRC as Source Systems\n    participant EQ as Equalisation\n    participant UFC as Unit FC\n    participant GTM as Group Tax Mgr\n\n    KPP->>IN: SP2DK issued\n    IN->>IN: OCR + parse\n    IN->>AG: Case created · 14-day clock starts\n    AG->>AG: Classify archetype\n    alt Confidence below 0.85\n        AG->>GTM: Escalate for manual classification\n        GTM-->>AG: Archetype confirmed\n    end\n    AG->>SRC: Read-only extract (entity + period)\n    SRC-->>AG: GL · SPT · faktur · bupot\n    AG->>EQ: Reconciliation request\n    EQ-->>AG: Variance schedule (traced)\n    AG->>AG: Retrieve precedents\n    AG->>AG: Draft + cite\n    AG->>UFC: Present draft pack\n    UFC-->>AG: Accept / annotate / reject\n    AG->>GTM: Route for approval\n    alt Above materiality threshold\n        GTM->>GTM: Consult counsel\n    end\n    GTM-->>AG: Approve and lock pack\n    GTM->>KPP: Human submits via Coretax\n    GTM->>AG: Record submission + outcome\n    AG->>AG: Close case",
    "steps": [
      {
        "id": "P-01",
        "actor": "Intake Service",
        "step": "Detect and ingest the SP2DK from the monitored Coretax export folder, the registered tax mailbox, or a manual upload of scanned mail.",
        "output": "Raw document + provenance record"
      },
      {
        "id": "P-02",
        "actor": "Intake Service",